title,description,url
Introduction to CalculusBest Calculus Courses [2023],"The course emphasises the key ideas and historical motivation for calculus, while at the same time striking a balance between theory and application, leading to ...Get the skills you need to succeed in Calculus with our online courses! Learn Calculus from expert instructors, gain practical knowledge, and boost your ...",https://www.coursera.org/learn/introduction-to-calculus
Single Variable Calculus | Mathematics - MIT OpenCourseWareCalculus for Beginners and Artists,"This calculus course covers differentiation and integration of functions of one variable, and concludes with a brief discussion of infinite series.Calculus for Beginners and Artists. Chapter 0: Why Study Calculus? Chapter 1: Numbers · Chapter 2: Using a Spreadsheet · Chapter 3: Linear Functions.",https://ocw.mit.edu/courses/18-01sc-single-variable-calculus-fall-2010/
400+ Calculus Courses & Certifications [2023],Calculus Courses · Vector Calculus for Engineers · Introduction to Dynamical Systems and Chaos · Nonlinear Dynamics: Mathematical and Computational Approaches.,https://www.classcentral.com/subject/calculus
Top Calculus Courses Online - Updated [May 2023],Courses to get you started · Most popular · Become a Calculus 1 Master · Become a Calculus 2 Master · Become a Calculus 3 Master · Calculus 1 with the Math Sorcerer.,https://www.udemy.com/topic/calculus/
Calculus I,"Calculus I · Course overview. From the co-founder of MasterClass, the world's best Calculus course is here. · Brilliant instructors. We've hand-selected three ...$597.00",https://www.outlier.org/products/calculus-i
Calculus 1 - Harvard Online Courses,"This is a complete course in first-semester calculus. Topics include the meaning, use, and interpretation of the derivative; techniques of differentiation; ...",https://pll.harvard.edu/course/calculus-1
Calculus I | Online College Course,"Our Calculus I online course covers limits, continuity, differentiation, Mean Value Theorem, integration and Fundamental Theorem of Calculus.Course Title: Prerequisite: Credits: Cost:",https://und.edu/academics/online/enroll-anytime/math165.html
"Introduction to Calculus, Interactive Online Video Course",Follow along with the examples in the Wolfram Cloud and use the material to prepare for the AP Calculus AB exam. The course starts with functions and limits ...,https://www.wolfram.com/wolfram-u/courses/mathematics/introduction-to-calculus/
Calculus Curriculum | Department of Mathematics,COURSE SYLLABI AND SCHEDULES Math 0010 Guidelines Schedule Math 0020 Guidelines Schedule Math 0025 Guidelines Schedule Math 0031 Guidelines Schedule Math ...,https://www.mathematics.pitt.edu/undergraduate/calculus-curriculum
Free Online Calculus Courses,We have upper secondary classes that can teach you about the process of distribution and integration in mathematics as well as training courses that focus on ...,https://alison.com/tag/calculus
Calculus I - Pauls Online Math Notes,"Jan 18, 2022 —",https://tutorial.math.lamar.edu/classes/calci/calci.aspx
Free Online Calculus Courses,"Free Online Calculus Courses · Calculus · Calculus / First Semester - Limits, Continuity, Derivatives · Calculus Revisited: Single Variable Calculus · Convex ...",https://www.courses.com/calculus
Business Calculus Course for Credit - ASU Universal Learner,Earn college credit with this business calculus course. Calculus for Business and Economics is offered as a self-paced or instructor-led online class.,https://ea.asu.edu/courses/brief-calculus-mat-210/
MOOC: Pre-University Calculus | TU Delft Online,Prepare for Introductory Calculus courses. Refresh or become familiar with some elementary level mathematics needed for BSc studies in technical ...,https://online-learning.tudelft.nl/courses/pre-university-calculus/
Calculus I | UC San Diego Division of Extended Studies,This course will introduce students to the different applications of both differential and integral calculus. Major topics covered in differential calculus ...,https://extendedstudies.ucsd.edu/courses-and-programs/calculus-i-1
AP Calculus AB - AP Students - College Board,Equivalency and Prerequisites. College Course Equivalent. A first-semester college calculus course devoted to topics in differential and integral calculus ...,https://apstudents.collegeboard.org/courses/ap-calculus-ab
Online Calculus Course,"May 20, 2022 —",https://junilearning.com/blog/guide/online-calculus-course/
Math 104: Calculus Course - Online Video Lessons,7 days ago —,https://study.com/academy/course/calculus.html
Calculus Online Math Course,"A single-variable calculus course covering limits, continuity, derivatives and their applications, definite and indefinite integrals, infinite sequences and ...",https://artofproblemsolving.com/school/course/calculus
MA005: Calculus I,"Start learning here, or check out our full course catalog. Log in or Sign up to enroll in courses, track your progress, gain access to final exams, and get a ...",https://learn.saylor.org/course/MA005
Introduction to Calculus,"Calculus is a 'sine qua non' for studying more advanced mathematics, physics, statistics, machine learning and data science. This course will introduce you ...",https://www.conted.ox.ac.uk/courses/introduction-to-calculus
Basic Calculus - 1 - Course,This course is a follow up to the calculus course taught in schools. Some of the notions done earlier will be presented in a more rigorous manner and some ...Course Status: Exam Date: Course Type: Duration:,https://onlinecourses.nptel.ac.in/noc21_ma16/preview
Calculus Classes - Columbia Math Department,This course serves as an introduction to the upper level undergraduate mathematics courses offered by the Department. Placement in the Calculus Sequences.,https://www.math.columbia.edu/programs-math/undergraduate-program/calculus-classes/
5 Free Courses to Master Calculus,"Oct 18, 2022 —",https://www.kdnuggets.com/2022/10/5-free-courses-master-calculus.html
Calculus Online Course,Thinkwell Calculus online math course covers both Calculus 1 & Calculus 2. No textbook required! Includes dozens of instructional videos and automatically ...$189.00,https://www.thinkwellhomeschool.com/products/calculus
Differential and Integral Calculus Course,This course is the first of the Calculus series and covers differential calculus and applications and the introduction to integration.$955.00,https://www.uclaextension.edu/sciences-math/math-statistics/course/differential-and-integral-calculus-math-xl-31a
Online Calculus Course for College Credit,Enroll in our low-cost online Calculus course for college credit. Save on the cost of your degree. Courses are self-paced & 100% online. Tutoring included.$69.00,https://www.straighterline.com/online-college-courses/mathematics/general-calculus-i/
MATH 1020: Calculus I (NEW) - UNE Online,"MATH 1020 is a four-credit calculus course that focuses on single variable calculus through graphical, analytical, and numerical techniques.",https://online.une.edu/science-prerequisites/calculus-i/
Calculus Is the Peak of High School Math. Maybe It's Time ...,"May 22, 2018 —",https://www.edweek.org/teaching-learning/calculus-is-the-peak-of-high-school-math-maybe-its-time-to-change-that/2018/05
M 305G – Preparation for Calculus - University Extension,"This course presents topics from algebra, coordinate geometry, and functions needed to provide solid preparation for studying calculus or other courses in ...$895.00",https://extension.utexas.edu/preparation-calculus-17230
Calculus I,Course level: Undergraduate. This course is an introduction to differential calculus. Students explore limits and continuity. They examine the basic concept ...,https://www.phoenix.edu/online-courses/mth280.html
Calculus I - UW Independent Learning,"Calculus I: This course will cover limits, theory, and application of the derivative; introduction to integration. After completing this course, ...",https://il.wisconsin.edu/course-catalog/calculus-i/u3600-114-4o/
Calculus and Probability Online,Calculus and Probability Online is an online course which covers similar material to the Victorian Certificate of Education (VCE) subject Mathematical ...,https://ms.unimelb.edu.au/study/online-calculus-and-probability
Calculus,"ABOUT THIS COURSE. It reviews the fundamentals taught in a one-semester college course in calculus. Our lessons are aligned to the content of the CLEP exam, ...",https://modernstates.org/course/calculus/
Basic-Calculus.pdf - Grade: 11,determine whether a function is continuous on an interval or not. STEM_BC11LC-IIIc-4. Page 2. K to 12 BASIC EDUCATION CURRICULUM. SENIOR HIGH ...,https://www.deped.gov.ph/wp-content/uploads/2019/01/Basic-Calculus.pdf
"To Keep Students in STEM fields, Let's Weed Out the ...","Mar 15, 2022 —",https://www.scientificamerican.com/article/to-keep-students-in-stem-fields-lets-weed-out-the-weed-out-math-classes/
Learn Calculus 1 in This Free 12-Hour Course,"Aug 27, 2020 —",https://www.freecodecamp.org/news/learn-college-calculus-in-free-course/
Calculus - Course Topics,Courses Designed to Take You Step-by-Step from Algebra to Differential Equations · Algebra I & II · Geometry · Trigonometry (Pre-Calculus) · Math Analysis (Pre- ...,https://calcworkshop.com/courses/
265 Introduction to Calculus Course Description: Studen,This course strengthens students' understanding of functions in preparation for the process of differentiation and integration. Calculus concepts explored ...,https://www.melroseschools.com/district-home/math/files/introduction-calculus-syllabus
Online Calculus 1 Course for College Credit,Course Materials for Calculus I (Calculus 1) · Inverse Functions · Algebraic Definition · Graphing and Properties of Logarithmic Functions · Solving exponential and ...,https://www.distancecalculus.com/calculus1/
Calculus,MT100 Calculus I (Fall/Spring: 4) MT100 is not open to students who have completed a calculus course at the college level. Students contemplating majors in ...,https://www.bc.edu/bc-web/schools/mcas/sites/math-advising/course-catalog/calculus.html
Report: Charting a New Course: Investigating Barriers on ...,"College calculus courses deserve their reputation as weed-out courses, but research points to numerous ways that math departments can transform calculus ...",https://justequations.org/resource/charting-a-new-course-investigating-barriers-on-the-calculus-pathway-to-stem
Math 2141: Calculus I,"This course covers topics of differential and integral calculus including limits and continuity, higher-order derivatives, curve sketching, differentials, ...",https://www.ccri.edu/math/pdfs/math2141spring20191.0.pdf
Calculus Courses - Rutgers Math,Honors students in the College of Engineering are required to enroll in these courses to fulfill their calculus requirement. The honors course 291 is considered ...,https://www.math.rutgers.edu/academics/undergraduate/placement-advice/1064-calculus-courses
Online High School Calculus Course – MAT420,"Take a fully accredited online high school calculus course with The American Academy to catch up, get ahead or earn a diploma. Click here to enroll today!$238.00",https://www.theamericanacademy.com/products/mat420
Linear Algebra,"Learn linear algebra for free—vectors, matrices, transformations, and more.",https://www.khanacademy.org/math/linear-algebra
Linear Algebra | Mathematics - MIT OpenCourseWare,"Course Description. This is a basic subject on matrix theory and linear algebra. Emphasis is given to topics that will be useful in other disciplines, ...",https://ocw.mit.edu/courses/18-06-linear-algebra-spring-2010/
Learn Linear Algebra with Online Courses and Programs,"Apr 7, 2023 —",https://www.edx.org/learn/linear-algebra
Mathematics for Machine Learning: Linear AlgebraBest Linear Algebra Courses & Certifications [2023],Offered by Imperial College London. In this course on Linear Algebra we look at what linear algebra is and how it relates to vectors and .Coursera offers 181 Linear Algebra courses from top universities and companies to help you start or advance your career skills in Linear Algebra.,https://www.coursera.org/learn/linear-algebra-machine-learning
Introduction to Linear Algebra | Online College Course,"UND's linear algebra online course studies the treatment of systems of linear equations, finite dimensional vector spaces, linear transformations, ...",https://und.edu/academics/online/enroll-anytime/math207.html
100+ Linear Algebra Courses & Certifications [2023],"Best online courses in Linear Algebra from Harvard, MIT, Georgia Tech, The Open University and other top universities around the world.",https://www.classcentral.com/subject/linear-algebra
Linear Algebra | UC San Diego Division of Extended Studies,"This is an introductory course in linear algebra, one of the most important and basic areas of mathematics, with many real-life applications.",https://extendedstudies.ucsd.edu/courses-and-programs/linear-algebra-3
Linear Algebra - Harvard Online Courses,This course covers the following topics: solving systems of linear equations; matrices and linear transformations; image and kernel of a linear transformation; ...,https://pll.harvard.edu/course/linear-algebra
MTH513T (Linear Algebra),"This is a course in linear algebra for MST Mathematics graduate students. It covers basic linear algebra tools such as matrices, matrix operations and ...",https://www.dlsu.edu.ph/wp-content/uploads/pdf/cos/mathematics/syllabus/MTH513T.pdf
Advanced Linear Algebra - Course,This course is designed to provide students with an understanding of Mathematical concept on Linear algebra that includes basic as well as advanced level.Course Status: Exam Date: Course Type: Exam Registration Ends:,https://onlinecourses.nptel.ac.in/noc23_ma17/preview
Complete linear algebra: theory and implementation in code,"Learn concepts in linear algebra and matrix analysis, and implement them in MATLAB and ... Top companies offer this course to their employeesThis course was ...",https://www.udemy.com/course/linear-algebra-theory-and-implementation/
University of Waterloo Math Online - Linear Algebra 1,"Topics include systems of linear equations, matrix algebra, elementary matrices, and computational issues. Other areas of the course focus on the real ...",https://open.math.uwaterloo.ca/1
Linear Algebra Refresher Course,"Students will learn concepts in linear algebra by applying them in computer programs. At the end of the course, you will have coded your own personal library of ...",https://www.udacity.com/course/linear-algebra-refresher-course--ud953
Learn Linear Algebra with This 20-Hour Course and Free ...,"Nov 19, 2020 —",https://www.freecodecamp.org/news/linear-algebra-full-course/
Linear Algebra,This free online linear algebra course teaches introductory concepts in vectors and matrix algebra. The course consists of 56 tutorials which cover the ...,https://www.engineer4free.com/linear-algebra.html
"Introduction to Linear Algebra, Interactive Online Video ...","The course starts with linear equations and matrices, followed by determinants and eigenvalues, and then moves on to inner products and the singular value ...",https://www.wolfram.com/wolfram-u/courses/mathematics/introduction-to-linear-algebra/
A First Course in Linear Algebra (A Free Textbook),"Typically such a student will have taken calculus, but this is not a prerequisite. The book begins with systems of linear equations, then covers matrix algebra, ...",http://linear.ups.edu/
Linear Algebra | GOA,In this course you will learn about the algebra of vector spaces and matrices by looking at how images of objects in the plane and space are transformed in ...,https://globalonlineacademy.org/student-program/student-courses/linear-algebra
Linear Algebra | Johns Hopkins Center for Talented Youth (CTY),"This course is equivalent to a first-year college linear algebra curriculum, exploring concepts typically offered in an introductory college linear algebra ...",https://cty.jhu.edu/programs/online/courses/linear-algebra-lin
Practice Introduction to Linear Algebra,"By the end of this course, you'll be able to solve systems of equations of all flavors and complexities using linear algebra, from a simple 2x2 matrix equation ...",https://brilliant.org/courses/linear-algebra/
Introduction to Linear Algebra with MATLAB,Learn the basics of Linear Algebra in MATLAB®. Use matrix methods to analyze and solve linear systems. Course modules. Introduction ...,https://matlabacademy.mathworks.com/details/introduction-to-linear-algebra-with-matlab/linalg
MATH 3242: Introduction to Linear Algebra Syllabus,"This course provides you with mathematical material in Linear Algebra foundational for mathematics, engineering and the sciences. It focuses on linear equations ...",https://www.memphis.edu/msci/syllabi/2021s/math3242-002.pdf
Linear Algebra - Joshua,"first course in Linear Algebra. The material is standard in that the subjects covered are Gaussian reduction, vector spaces, linear maps, determinants, ...",https://joshua.smcvt.edu/linearalgebra/book.pdf
MAT 280 Linear Algebra Course Outline,"This course provides an introduction to linear algebra topics. Emphasis is placed on the development of abstract concepts and applications for vectors, ...",https://www.durhamtech.edu/sites/default/files/course_outlines/MAT280.pdf
Beginning Linear Algebra,Linear algebra and its matrices appear throughout the sciences and in the mathematical parts of the social sciences. This basic course is prerequisite to ...,https://www.conted.ox.ac.uk/courses/beginning-linear-algebra
MATH-UA 140 Linear Algebra | Department of Mathematics,Linear algebra is an area of mathematics devoted to the study of structure-preserving operators on special sets (linear operators on vector spaces). Linear ...,https://math.nyu.edu/dynamic/courses/undergrad/math-ua-140/
Mathematics (MATH) 270 - Linear Algebra I,"The course covers systems of linear equations, matrices, inverse of a matrix, determinant, vectors in two-, three- and n-dimensions, Euclidean and general ...",https://www.athabascau.ca/syllabi/math/math270.html
MATH 208 - Introduction to Linear Algebra - Acalog ACMS™,"Course Outcomes. Use matrix methods to set up, solve, and analyze linear systems for applied and general situations. Describe and solve problems using the ...",https://catalog.bellevuecollege.edu/preview_course_nopop.php?catoid=8&coid=32499
A Course in Linear Algebra with Applications,Matrix Algebra · Systems of Linear Equations · Determinants · Introduction to Vector Spaces · Basis and Dimension · Linear Transformations · Orthogonality in Vector ...,https://www.worldscientific.com/worldscibooks/10.1142/1335
01:640:250 - Introductory Linear Algebra - Rutgers Math,"Courses. 01:640:250 - Introductory Linear Algebra ... Systems of linear equations, Gaussian elimination, matrices and determinants, vectors in two- and ...",https://www.math.rutgers.edu/academics/undergraduate/courses/948-01-640-250-introductory-linear-algebra
MAT 175 - Elementary Linear Algebra | Course Finder | Illinois ...,"Vector geometry, matrices, systems of linear equations, vector spaces, linear transformations, eigenvalues and eigenvectors, diagonalization, ...",https://coursefinder.illinoisstate.edu/mat/175/
Introduction to Linear Algebra | Free Online Course,Learn linear algebra in this Maths course and gain practical skills that can be applied in many fields as you apply linear equations to real-world problems.,https://alison.com/course/introduction-to-linear-algebra
5 Free Courses to Master Linear Algebra,"Oct 13, 2022 —",https://www.kdnuggets.com/2022/10/5-free-courses-master-linear-algebra.html
Centrality of Linear Algebra,by CC Cowen —,https://www.maa.org/centrality-of-linear-algebra
Course - Linear Algebra and Geometry - MA6201,"Course - Linear Algebra and Geometry - MA6201 ... We solve linear equations using Gaussian elimination, and learn to write equations with vectors and ...",https://www.ntnu.edu/studies/courses/MA6201
Courses - Linear Algebra - Study at UniSA,Course aim. To develop basic concepts in linear algebra and apply them to problems using analytic and numerical techniques. · Course content. Module 1: Linear ...,https://study.unisa.edu.au/courses/101193
MATH 2318 - Linear Algebra - University of Houston,"Course Description: Solutions of systems of linear equations, matrices, vector spaces, linear transformations, similarity eigenvalues and eigenvectors. Upon ...",https://uh.edu/nsm/math/undergraduate/courses/math2318/
MAT* 274: Linear Algebra - Manchester Community College,"A first course in linear algebra for students in mathematics, science and engineering. Topics include: systems of linear equations, matrices, determinants, ...",https://catalog.mcc.commnet.edu/preview_course_nopop.php?catoid=6&coid=6184
Linear Algebra | Department of Mathematics - OSU Math,"MATH 2568: Linear Algebra. Matrix algebra, vector spaces and linear maps, bases and dimension, eigenvalues and eigenvectors ... Course Description Download:.",https://math.osu.edu/courses/math-2568
Linear Algebra Course Number: MATH229 Department,Course Description: This course is designed to introduce students to the theory of systems of linear equations and to mathematical.,https://massasoit.edu/wp-content/uploads/2020/02/MATH229-outcomes.pdf
Linear Algebra | School of MathematicsA Second Course on Linear Algebra | School of Mathematics,"Supplemental text: ""Introduction to Linear Algebra"", 4th edition, by Gilbert Strang (a course packet option will be available for students who do not wish to ...",https://math.gatech.edu/courses/math/1554
Linear Algebra: Help & Tutorials Course,"May 15, 2023 —",https://study.com/academy/course/linear-algebra-help-tutorials.html
Mastering Linear Algebra: An Introduction with Applications,"May 3, 2023 —",https://www.thegreatcourses.com/courses/mastering-linear-algebra-an-introduction-to-applications
What is Linear Algebra? (A quick introduction),"... to see in a typical College Linear Algebra class (i.e., Matrix Algebra). All of the topics are covered in detail in our Online Linear Algebra Course.",https://calcworkshop.com/linear-algebra/
Linear Algebra - Curriculum (Math),"The course will cover the basic elements of a college-level Introduction to Linear Algebra course, including: matrix algebra; determinants; ...",https://www.bths.edu/apps/pages/index.jsp?uREC_ID=228633&type=d&termREC_ID=&pREC_ID=443608
Linear Algebra Course - UCR Extension,"Based on the concepts of rate and ratio, this course addresses topics that lead to an understanding of linear functions and equations.",https://extension.ucr.edu/course/721184/LinearAlgebra
Linear Algebra | MATH 2232,MATH 2232 is a one semester introductory course designed to provide a foundation in the mathematics of linear algebra. This course is often the first course ...,https://www.douglascollege.ca/course/math-2232
Differential Equations | Mathematics - MIT OpenCourseWare,Course Description. Differential Equations are the language in which the laws of nature are expressed. Understanding properties of solutions of differential ...,https://ocw.mit.edu/courses/18-03-differential-equations-spring-2010/
Differential Equations,"Learn differential equations for free—differential equations, separable equations, exact equations, integrating factors, and homogeneous equations, ...",https://www.khanacademy.org/math/differential-equations
"Learn Differential Equations with Online Courses, Classes ...","MIT offers an introductory course in differential equations. You'll learn to solve first-order equations, autonomous equations, and nonlinear differential ...",https://www.edx.org/learn/differential-equations
Best Differential Equation Courses & Certifications [2023]Differential Equations Part I Basic Theory,"Coursera offers 90 Differential Equation courses from top universities and companies to help you start or advance your career skills in Differential ...This introductory courses on (Ordinary) Differential Equations are mainly for the people, who need differential equations mostly for the practical use in ...",https://www.coursera.org/courses?query=differential%20equation
Elementary Differential Equations | Online College Course,"This mathematics online course covers the solution of elementary differential equations by elementary techniques, including: Laplace transforms; Introduction to ...",https://und.edu/academics/online/enroll-anytime/math266.html
Lectures on Differential Equations,These notes are for a one-quarter course in differential equations. The approach is to tie the study of differential equations to specific applications in ...,https://www.math.ucdavis.edu/~tracy/courses/math22B/22BBook.pdf
Top Differential Equations Courses Online,"An in-depth course on differential equations, covering first/second order ODEs, PDEs and numerical methods, too!Rating: 4.7 out of 5218 reviews3.5 total hours48 ...",https://www.udemy.com/topic/differential-equations/
DIFEQUA – Differential Equations,"A course in the solution of first order differential equations and higher order differential equations, Laplace. Transformations, power series method and ...",https://www.dlsu.edu.ph/wp-content/uploads/2018/06/difequa.pdf
Differential Equations Online Course for Academic Credit,"Differential Equations is the traditional sophomore-level course int the engineering-level Calculus sequence, examining the solution of ordinary ...",https://www.distancecalculus.com/diffeq/
Differential Equations,This free online differential equations course teaches several methods to solve first order and second order differential equations. The course consists of ...,https://www.engineer4free.com/differential-equations.html
