title,description,url
Top Writing Courses Online - Updated [May 2023]Top Free Writing Courses & Tutorials Online,"Learn to improve your written communication and literacy skills with writing courses offered on Udemy, taught by top rated instructors.Learn to improve your written communication and literacy skills with writing courses offered on Udemy, taught by top rated instructors.",https://www.udemy.com/topic/writing/
Writing workshops and online courses from the Philippines,"We're a writing school that welcomes anyone who wants to learn how to write stories—no magical talent, prior training, or writing experience required.",https://www.storywritingschool.com/
The 10 Best Online Creative Writing Classes of 2023 - Intelligent,10 Best Online Writing Courses Courses or Bootcamps · Coursera Creative Writing Specialization by Wesleyan University · Udemy Secret Sauce of Great Writing.Distinguished university-level faculty: What we like:,https://www.intelligent.com/best-online-courses/creative-writing-classes/
Best Online Writing Courses: 18 Top Options (2023),"Oct 24, 2022 —",https://becomeawritertoday.com/best-online-writing-courses/
11 free online writing courses for getting real good at words,"Jan 31, 2022 —",https://mashable.com/article/free-online-writing-courses
10 Best FREE Online Writing Courses with Certificates (2023),"Apr 1, 2023 —",https://www.guru99.com/free-online-writing-courses.html
Essay and report writing skills - OpenLearn,"This free course, Essay and report writing skills, is designed to help you develop the skills you need to write effectively for academic purposes.",https://www.open.edu/openlearn/education-development/essay-and-report-writing-skills/content-section-0
Free Creative Writing Course for Beginners ... - YouTube,18 key moments,https://www.youtube.com/watch?v=wDhU9fOAhiA
Writing Courses | Harvard University,"Browse the latest online writing courses from Harvard University, including ""Rhetoric: The Art of Persuasive Writing and Public Speaking"" and ""Effective ...",https://pll.harvard.edu/subject/writing
Online Writing Classes,"Online Writing Classes · Fiction · Nonfiction · Scriptwriting · Comedy, Poetry & Song · Professional Development · Essentials · Intensives · Teen.",https://www.writingclasses.com/classes/online
Writing in the Sciences | Course | Stanford Online,Earn a Coursera course certificate with Stanford. Writing in the Sciences - Stanford School of Medicine & Stanford Online.,https://online.stanford.edu/courses/som-y0010-writing-sciences
Writing Online Training Courses,Trending courses · Business Writing Principles. 1h 21m. Business Writing Principles · Note-Taking for Business Professionals. 47m. Note-Taking for Business ...,https://www.linkedin.com/learning/topics/writing-7
Best Business Writing Courses | Individuals & Groups,"Best business writing training courses for individuals and groups, based on our 20+ years of teaching business writing. Available online and in person.",https://www.instructionalsolutions.com/business-writing-courses
Online Creative Writing Classes,"Expand your horizons as you learn more about creative writing. Try these classes that teach about creative writing techniques, tools, and topics like ...",https://www.skillshare.com/en/browse/creative-writing
Creative Writing Courses,"Explore Creative Writing Courses at The Open University. Choose from a Range of Degrees, Diplomas, Certificates and Modules.",https://www.open.ac.uk/courses/creative-writing
Online Writing Courses: New Writing Classes Starting ...,Join online writing courses with our award-winning instructors. Our online writing classes are top-quality and suited to all experience levels.,https://writers.com/online-writing-courses
Free Online Writing Skills Courses,"Alison offers free online writing courses. Learn how to write with clarity, confidence and style. Get started on your learning journey today.",https://alison.com/tag/writing-skills
Top 9 Content Writing Courses in Philippines With ...,"IIM SKILLS CONTENT WRITING COURSE MODULES & CONTENT ; Module 7 Social Media Writing & Video Scripts, Module 8) Creative Writing ; Module 9) SOP & Business Listing ...",https://iimskills.com/content-writing-courses-in-philippines/
Online Creative Writing Courses - Short and self-paced,"Building on our free How to be a Productive Writer course, writer and tutor Ben Johncock reveals more tips and tricks for writing more, writing faster and ...",https://nationalcentreforwriting.org.uk/online-writing-courses/
The Best Online Courses in Writing | Updated 2023,Online Writing courses · Copywriting for Social Media · Writing Exercises: From the Blank Page to Everyday Practice · Writing a Novel Step by Step · Introduction to ...,https://www.domestika.org/en/courses/category/18-writing
Online business writing courses and grammar courses with ...,The Business Writing Center has 45 online business writing courses taught by highly qualified instructors. Your instructor will coach you through revising ...,https://businesswriting.com/
Online courses in creative writing,Part-time study in creative writing · Upcoming courses · Magical Realism · Critical Reading (Online) · Jane Austen (Online) · Literary Theory: An Introduction ( ...,https://www.conted.ox.ac.uk/about/online-courses-in-creative-writing
Business writing and storytelling,"This course will enable you to gain clarity about what you have to say, why and to whom, and to reflect critically on your own writing.",https://education.economist.com/courses/professionalcommunication
Hurley Write: Business & Professional Writing Courses,"Hurley Write is a leading company in developing and teaching professional writing courses, including classes on business, technical, and more.",https://www.hurleywrite.com/
Business Writing,About this course. Writing well is one of the most important skills you can develop to be successful in the business world. Over seventy companies and twenty ...,https://learndigital.withgoogle.com/digitalgarage/course/business-writing
Creative Writing Courses & Certificates,Discover Creative Writing courses & certificate programs offered by UCLA Extension. Learn about these courses and more at UCLAExtension.edu.,https://www.uclaextension.edu/writing-journalism/creative-writing
Writing Course Descriptions - Ottawa,"Writing Course Descriptions. The course description orients students by outlining the rationale for the course subject or theme, framing a brief overview of ...",https://www.algonquincollege.com/lts/understanding-course-outlines/writing-course-descriptions/
Bachelor of Arts in Creative Writing -,"The creative writing classes consist of both lecture sessions, in which literary models ... Creative Writing is also considered an effective pre-Law course.",https://www.ust.edu.ph/academics/programs/bachelor-of-arts-in-creative-writing/
Creative Writing,"Creative Writing offers training in various approaches and techniques in the writing of fiction, poetry, essay, and drama. These courses are taught by ...",https://decl.kal.upd.edu.ph/programs/creative-writing/
Technical Writing,Every engineer is also a writer. This collection of courses and learning resources aims to improve your technical documentation.,https://developers.google.com/tech-writing
The Art of Writing - UW Professional & Continuing Education,This course is part of a certificate program. You can also take it without enrolling in the program. Get Details & Register ...,https://www.pce.uw.edu/courses/the-art-of-writing
Marketing Writing for UX Writers,Sign up for this video course based on Kinneret Yifrah's Microcopy book. Visit our website to learn what the course provides and why learn to write ...$430.00,https://uxcontent.com/cx-writing/
First-year writing courses - Eberly Center,"The course assumes that reading and writing are inseparable practices for responsible, academic authoring. Students are exposed to a variety of different texts, ...",https://www.cmu.edu/teaching/designteach/teach/instructionalstrategies/writing/CMwritingcourses.html
Clearly Write: A Course on Effective Writing for Executives,"Good writing skills are essential for corporate executives at any job level. ... At the end of the course, you will be given a copy of a writing guide ...Next Course Starts On: Level:",https://academy.smu.edu.sg/clearly-write-course-effective-writing-executives-2801
Writing a Research Paper course,"About this course. 'Writing a Research Paper' focuses on how to write an effective, clear and concise article that will appeal to a broad audience as well ...",https://masterclasses.nature.com/writing-a-research-paper/16605458
Online courses,Learn the foundations of compelling stories with these creative writing courses. Creative Writing Stage 1. Discover the secrets to writing compelling fiction.,https://www.writerscentre.com.au/online-writing-courses/
Writing & Creative Writing Courses in London,Writing Courses · Creative Writing Intensive - 5 Days · Creative Writing Intensive - 5 Days · Creative Writing Summer School · Creative Writing Summer School.,https://www.city-academy.com/writing-courses
Schools offering Literature & Writing courses in the ...,A list of universities and colleges offering Literature and Writing courses in the Philippines. Whenever possible we provide full details about the courses ...,https://www.finduniversity.ph/literature-schools/
Faber Academy: Creative Writing Courses & Manuscript ...,"Creative writing courses and manuscript assessments by Faber and Faber. Online writing courses, London writing courses and readers reports.",https://faberacademy.com/
ENGL210: Technical Writing,"Start learning here, or check out our full course catalog. Log in or Sign up to enroll in courses, track your progress, gain access to final exams, and get a ...",https://learn.saylor.org/course/ENGL210
Business Writing Skills: How to Write Effectively - Ateneo CCE,This is the intermediate course in the Professional Writing Program. Who should attend. This course is for professionals who want to enhance their business ...,https://cce.ateneo.edu/program-calendar/business-writing-skills-how-write-effectively
Professional and Personal Writing - UBC Extended Learning,"Choose from more than 20 professional and personal online writing courses. Build your writing skills, increase your confidence, find new ways to express ...",https://extendedlearning.ubc.ca/study-topic/professional-writing
How to Write Better: General Writing Class,"“I've taken other writing classes and this one was by far the most helpful and most practical. ... Now, of course, things are a little different.",https://www.theminimalists.com/class/
Why Include Writing in My Courses? - The WAC Clearinghouse,One or two writing classes just can't provide enough daily practice over the course of an undergraduate program of study. Basic Principles of WAC. As one ...,https://wac.colostate.edu/resources/wac/intro/include/
Business Writing Course: Taught by Bestselling Author ...,Write better with bestselling author Dan Pink's top writing tips; Build your editing and proofreading skill set. Course Details: 3 lessons. 12 videos. 0 ...,https://academy.hubspot.com/courses/business-writing
Best Critical Thinking Courses [2023],"In summary, here are 10 of our most popular critical thinking courses ; Introduction to Logic and Critical Thinking · Duke University ; Solving Problems with ...",https://www.coursera.org/courses?query=critical%20thinking
"Learn Critical Thinking Skills With Online Courses, Classes ...","Dec 20, 2022 —",https://www.edx.org/learn/critical-thinking-skills
Logical and Critical Thinking - Online Course,Improve your logical and critical thinking skills in this free online course. Identify common obstacles to effective thinking.,https://www.futurelearn.com/courses/logical-and-critical-thinking
Enroll in MIT's Critical Thinking & Decision Making Online ...,Critical Thinking and Decision Making. A three-week online course for technical professionals that will explore each concept of what it means to think about ...$949.00,https://xpro.mit.edu/courses/course-v1:xPRO+LASERxE4/
Top Critical Thinking Courses Online - Updated [May 2023],"Learn the best critical thinking techniques and practices from top-rated Udemy ... the fundamentals of logic, Udemy has a course to help you think critically.$9.99",https://www.udemy.com/topic/critical-thinking/
Online Courses in Critical Thinking,"In this course, you will be introduced to the elements of reasoning, universal intellectual standards, and intellectual traits through readings, discussions ...",https://www.criticalthinking.org/pages/online-courses-for-instructors/574
Logical and Critical Thinking,Logical and Critical Thinking. Improve your logical and critical thinking skills in this free online course. Identify common obstacles to effective thinking.,https://learndigital.withgoogle.com/digitalgarage-au/course/logical-critical-thinking
Critical Thinking Certificate Program - eCornell,"Gain the critical strategic mindset needed to succeed in management and executive functions. Earn your certificate with eCornell today!$3,750.00",https://ecornell.cornell.edu/certificates/leadership-and-strategic-management/critical-thinking/
16 Best Free Online Critical Thinking Courses,Introduction to Critical Thinking and Logic · Unit 1: Introduction and Meaning Analysis · Unit 2: Argument Analysis · Unit 3: Basic Sentential Logic · Unit 4: Venn ...,https://argumentful.com/16-best-free-online-critical-thinking-courses/
Critical Thinking Free Online Course,Critical Thinking short course covers the following key topics: Defining Critical Thinking; Characteristics of a Critical Thinker; Common Critical Thinking ...,https://www.oxfordhomestudy.com/courses/online-management-courses/critical-thinking-free-online-course
100+ Critical Thinking Courses & Certifications [2023],Critical Thinking Courses · Critical Thinking at University: An Introduction · Aprender · Mindware: Critical Thinking for the Information Age · English for Media ...,https://www.classcentral.com/subject/critical-thinking
Thinking Critically Free Online Course,"Learn about the critical thinking skills, group thinking, problem solving, and presenting solutions from this Free, Thinking Critically online course.",https://alison.com/course/thinking-critically
Critical Thinking Course,"Critical Thinking Course provides training in identifying support structures, perspectives, and arguments. Additionally, you will learn to critically ...",https://alprograms.com/critical-thinking-course/
Defining Critical Thinking Courses - General Education,"Concisely summarized, a “Critical Thinking” class is a 100 or 200 level course designed to help freshman and sophomore students learn key cognitive skills, ...",https://www.marshall.edu/gened/defining-critical-thinking-courses/
An Introduction to Critical Thinking,Course aims. To help students improve their critical thinking skills. · Teaching methods. The tutor will present the course content in an interactive way using ...,https://www.conted.ox.ac.uk/courses/an-introduction-to-critical-thinking
PHIL102: Introduction to Critical Thinking and Logic,"Its purpose is to provide you with the basic tools of analytical reasoning, which will give you a distinctive edge in a wide variety of careers and courses of ...",https://learn.saylor.org/course/PHIL102
Courses for Critical Thinking,"Part of critical thinking is being able to identify, construct, and evaluate arguments, because only then will you be able to reach logical conclusions and ...",https://www.skillsoft.com/channel/critical-thinking-f220ddf0-2150-11e7-a947-2bfd699dcbff
Critical Thinking and Problem Solving in Today's Changing ...,"Set yourself up for workplace success with the HubSpot Academy course. ... Every day, business workers need to employ critical thinking to deduce ...",https://academy.hubspot.com/courses/critical_thinking?library=true&
Critical and Creative Thinking Course,"The aim of this course is to build your skills in critical and creative problem solving in both workplace and everyday situations. The development of your ...Mon, Jul 10Thu, Sep 21",https://cce.sydney.edu.au/course/CCT2
Critical Thinking: An Online Course,"This course equips students with the skills and habits of critical thinking. It teaches practical techniques for confidence, discerning critical engagement ...",https://campus.sagepub.com/critical-thinking-course
Introduction to Critical Thinking,Critical thinking is an intellectual model for reasoning through issues to reach well-founded conclusions. It may be the single most valuable skill that one can ...,https://www.ccp.edu/academic-offerings/professional-development/non-credit-courses/introduction-critical-thinking
"Develop Critical Thinking, Decision-Making, and Problem- ...",7 courses 4 hours of content · Think through problems before reaching a conclusion. · Ask questions that facilitate better decision-making. · Improve your judgment ...,https://www.linkedin.com/learning/paths/develop-critical-thinking-decision-making-and-problem-solving-skills
Critical Thinking and other Higher-Order Thinking Skills,"The place to begin, and most obvious space to embed critical thinking in a syllabus, is with student-learning objectives/outcomes. A well-designed course ...",https://cetl.uconn.edu/resources/design-your-course/teaching-and-learning-techniques/critical-thinking-and-other-higher-order-thinking-skills/
WSQ DISPLAY CRITICAL THINKING AND ANALYTICAL ...,"Course Overview. WSQ Display Critical Thinking and Analytical Skills powered by Wiley, aims to equip you with the knowledge and skills to think smarter by ...",https://www.ntuclearninghub.com/-/course/wsq-display-critical-thinking-analytical-thinking-skills-powered-by-wiley
Critical Thinking Across the Curriculum,The learning outcomes of the introductory course: · Develop metacognitive thinking strategies. · Evaluate and construct arguments. · Evaluate sources and ...,https://www.sacredheart.edu/academics/academic-programming/core-curriculum/critical-thinking-across-the-curriculum/
Develop Your Critical Thinking Skills,"This course is designed to provide managers with the skills and knowledge to implement and cope with change at the individual, group and organisational levels.",https://aimwa.com/course/develop-your-critical-thinking-skills/
Logic and Critical Thinking - Programs and Courses - ANU,"This course aims to introduce students to practices of argumentation, critical analysis, and evaluation. Such skills in critical thinking are integral to ...",https://programsandcourses.anu.edu.au/course/phil1005
Critical Thinking,During the Critical Thinking Course you will analyse different scenarios and complete interactive activities which will help you put theoretical knowledge ...,https://etonx.com/course/critical-thinking/
Session 3: 1 What is critical thinking? - OpenLearn ...,Start this free course now. Just create an account and sign in. Enrol and complete the course for a free statement of participation or digital badge if ...,https://www.open.edu/openlearn/ocw/mod/oucontent/view.php?id=51387&section=1
CITC811 - Critical Thinking,"With the tools you gain in this course, you will be able to differentiate critical thinking from non-critical thinking, recognise and evaluate assumptions, ...",https://www.nait.ca/nait/continuing-education/courses/citc811-critical-thinking
Free Critical Thinking Courses online,Free Critical Thinking Courses online · Mindware: Critical Thinking for the Information Age · Problem Solving and Critical Thinking Skills · Critical thinking: ...,https://coursesity.com/free-tutorials-learn/critical-thinking
Critical Thinking Training Course,"The PD Training Critical Thinking Training Course provides training in identifying support structures, perspectives and arguments and how to critically ...",https://pdtraining.com.au/courses/critical-thinking-training-course
Critical Thinking Skills Training | Online & In Person | AMA,Enroll now for AMA's critical thinking course! Join the millions of leaders who trust our expert faculty to enhance your critical thinking ability.,https://www.amanet.org/critical-thinking/
Critical Thinking Training Course,"This Zoe training course will empower you in your Critical thinking by providing detailed knowledge of thoughts, logic, reasoning and arguments. This course ...",https://zoetalentsolutions.com/course/critical-thinking-training-course/
FACILITATING CRITICAL THINKING THROUGH ONLINE ...,by M Lunney · 2008 · Cited by 38 —,https://files.eric.ed.gov/fulltext/EJ837517.pdf
Critical Thinking and Problem Solving,AIM's Critical Thinking and Problem Solving short course provides you with the skills you need to make decisions that are aligned to business goals.,https://www.aim.com.au/health-effectiveness/courses/critical-thinking-and-problem-solving
"Improve Critical Thinking Skills | Online Courses, Training ...","In addition, critical thinking boosts productivity, enhances your ability to solve problems, and is a must-have for creative work. How to Learn Critical ...",https://emeritus.org/skills/learn-critical-thinking/
Critical Thinking for Business - Online Course,"Critical thinking is essential for optimising business models, convincing clients and making overall better decisions. Learn how to test, ...",https://iversity.org/en/courses/critical-thinking-for-business
Critical Thinking: Courses for Teachers,Discover how to improve your students' thinking skills for comprehensive and autonomous learning with one of our courses on critical thinking.,https://www.teacheracademy.eu/topic/critical-thinking-and-problem-solving/
Critical Thinking - Stanford Encyclopedia of Philosophy,by D Hitchcock · 2018 · Cited by 323 —,https://plato.stanford.edu/entries/critical-thinking/
Critical Thinking | Basic Reading and Writing,"Critical thinking skills are perhaps the most fundamental skills involved in making ... On the last day of class when students present their projects, ...",https://courses.lumenlearning.com/suny-basicreadingwriting/chapter/outcome-critical-thinking/
Critical Thinking for Problem Solving,Learning Objectives · Analyze qualities and habits of effective critical thinkers · Evaluate strategies for overcoming common barriers to critical thinking ...,https://www.managementconcepts.com/course/id/4060
Creative and Critical Thinking Course,Critical Thinking: What It Is and Why It Matters · Right Brain! Left Brain! · Get Out of the Box: Basic Creative-Thinking Skills · Beyond Brainstorming: The Osborn ...,https://www.businesstrainingworks.com/onsite-courses/creative-and-critical-thinking-skills-training-course/
Course - Critical Thinking - IMT6271,"The course is designed such as to provide knowledge, skills and general competences that will be directly usable for candidates in their research work. The ...",https://www.ntnu.edu/studies/courses/IMT6271
Critical Thinking | Courses,"Learn more about the Critical Thinking for our MBA business ... In this course, students will learn to perform critical evaluations with fewer ...",https://www.globis.ac.jp/courses/critical-thinking/
Clear Writing through Critical Thinking (WRIT7100),"Class Length: This class is listed as a 3 day course. For in-person training sessions, participants are required to download the course materials to a personal ...$1,159.00",https://www.graduateschool.edu/courses/clear-writing-through-critical-thinking
Complex Problem Solving - Critical Thinking Course,Discover how to solve complex problems in three steps on IMD's Complex Problem Solving course. Boost your critical thinking capabilities and develop ...,https://www.imd.org/strategy/cps/complex-problem-solving-online-course/
Critical Thinking Course in Singapore,Course benefits · Understand what critical thinking skills really are · Understand rational vs. · Understand critical thinking vs. · Identify and overcome common ...,https://www.sim.edu.sg/professional-development/courses/course-listing/critical-thinking-and-reasoning
Critical thinking training: 5 key lessons for employees,"Dec 21, 2022 —",https://bigthink.com/plus/critical-thinking-training/
Critical Thinking,All business professionals who want to enhance their thinking skills in order to achieve better results. Live Online classes are delivered in partnership with ...,https://cmcoutperform.com/critical-thinking
Best Problem Solving Courses & Certifications [2023]Effective Problem-Solving and Decision-Making,"Coursera offers 421 Problem Solving courses from top universities and companies to help you start or advance your career skills in Problem Solving.Throughout this course, we will learn an overarching process of identifying problems to generate potential solutions, then apply decision-making styles in order ...",https://www.coursera.org/courses?query=problem%20solving
"Learn Problem Solving with Online Courses, Classes, & ...",Take online problem solving skills. Learn problem solving skills online to advance your career with edX today!,https://www.edx.org/learn/problem-solving
Develop Your Problem-Solving Skills,Boost your career and develop your problem-solving skills with one of our online courses or programs. New problem-solving skills will help you rise through ...,https://www.futurelearn.com/courses/collections/problem-solving
Free Online Problem Solving Courses,These free online courses in problem solving have everything you need to find innovative solutions to tough problems. Strong problem solving skills help you ...,https://alison.com/tag/problem-solving
Top Problem Solving Courses Online - Updated [May 2023],Courses to get you started · Most popular · CAT Quant 42 Hours Preparation | CAT 99%ile Instructor · Lean Problem-Solving for Team Members and Leaders · Creative ...,https://www.udemy.com/topic/problem-solving/
