title,description,url
Graphic Design Online Training Courses,"10,616Results for ""Graphic Design"" · InDesign 2023 Essential Training · Lightroom Classic Essential Training · InDesign 2022 Essential Training · Learning Canva.",https://www.linkedin.com/learning/topics/graphic-design
Free Graphic Design Course with Certificate Online,Take free Graphic design course for your level and get basic understanding of using photoshop. Enrol for graphic designing and get free online certificate.,https://www.mygreatlearning.com/academy/learn-for-free/courses/intro-to-graphic-design-with-photoshop
What Courses Will I Take for a Graphic Design Degree?,"Graphic Web Design is a core focus and course in the graphic design degree that teaches all the ins and outs of graphic web design, common software and tools of ...",https://www.graphicdesigndegreehub.com/faq/what-courses-will-i-take-for-a-graphics-design-degree/
Top Graphic Design School Trains Multi-Talented Digital ...,A CIIT graduate comes out as a total package. Their graphic design course enables students to learn important life values aside from the knowledge in the latest ...,https://www.ciit.edu.ph/top-graphic-design-school/
15 Extremely Helpful Free Graphic Design Courses,,https://www.format.com/magazine/resources/design/free-online-graphic-design-courses
10 Excellent Free Online Graphic Design Courses,1. CalArts Graphic Design Specialization · 2. Canva Design School: Graphic Design Basics · 3. Logo Design Fundamentals · 4. Introduction to Graphic Design History.,https://dribbble.com/resources/free-graphic-design-courses-online
The Graphic Design School | Online Graphic Design Courses,"Welcome to The Graphic Design School. We offer a range of online graphic design courses for different levels. We have short, quick courses and full length ...",https://www.thegraphicdesignschool.com/
Graphic Design Courses for Filipino Students - AECC Global,"BA - Graphic Design ... About this course: In this course, you will primarily learn about designing products, colour choices, letterforms, and understanding ...",https://search.aeccglobal.com/article/philippines/graphic-design-courses-for-filipino-students
Graphic Design,Course list · Certificate IV in Design (Graphic Design) · Graphic Designers communicate through images and words · The umbrella of Graphic Design covers many ...,https://www.northmetrotafe.wa.edu.au/graphic-design
Diploma of Graphic Design CUA50720-01,"Overview About this course ... Strengthen your creative and technical design skills and gain experience in producing designs for advertising, packaging and ...",https://www.tafensw.edu.au/course-areas/design-and-media/courses/diploma-of-graphic-design--CUA50720-01
"Graphic Design Foundations, Associate Certificate, Part- ...","If you're interested in working in the graphic arts, earning your associate certificate is a great way to begin your training and test the field. Many students ...",https://www.bcit.ca/programs/graphic-design-foundations-associate-certificate-part-time-6505acert/
Graphic Design Courses & Digital Design,Graphic design courses ; Certificate III in Design Fundamentals · Junior Graphic Design Assistant; Design Assistant ; Diploma of Graphic Design · Typesetter ...,https://tafeqld.edu.au/courses/study-areas/creative-industries/visual-arts-and-design/graphic-design
"Graphic Design - Seneca, Toronto, Canada","Seneca's graphic design courses and graphic design programs provide skills to create effective design solutions for interactive, print design projects.",https://www.senecacollege.ca/programs/fulltime/GRA.html
The Best Online Courses in Graphic Design | Updated 2023,Online Graphic Design courses · Canva for Beginners: Create Professional Designs · Introduction to Adobe Photoshop · Instagram Feed Design with Canva · Introduction ...,https://www.domestika.org/en/courses/area/34-graphic-design
Communication and graphic design short courses,"Our exciting range of communication and graphic design short courses will help you develop your inner creativity to explore, experiment and innovate in an ...",https://www.arts.ac.uk/subjects/communication-and-graphic-design/short-courses
Graphic Design I: Introduction to Graphic Design,"Philippine Center for Creative Imaging (PCCI), Manila's premier training center for digital media and photography. We offer world-class training in Adobe, ...",https://pcci.com.ph/Courses/SpecialClasses-Events/intro-graphic-design.html
BA(Hons) Graphic Design,"BA(Hons) Graphic Design is based at the Arnolfini, at the heart of Bristol's creative and cultural community. You'll learn from practising graphic designers in ...Course code: Campus: Entry year: Level:",https://courses.uwe.ac.uk/W211/graphic-design
Graphic Design and Print Media,"Study a wide range of Graphic Design & Print Media courses and earn a Certificate, Diploma or Advanced Diploma qualification in Arts & Design at TAFE SA.",https://www.tafesa.edu.au/courses/arts-design/graphic-design-print-media
Graphic Design,"School of Academics, Applied Arts & Tourism; Duration: Two Years; Start Date: September 2023. APPLY NOW. Locations & Delivery Modes; Description; Courses.",https://www.cna.nl.ca/program/graphic-design
Graphic Design - Humber College,Humber's Graphic Design advanced diploma program develops creative and strategic designers who wish to execute a wide range of visual communication ...,https://mediaarts.humber.ca/programs/graphic-design.html
"Graphic Design: Courses, Fee 2023, Subjects, Syllabus, ...","Graphic design is a form of visual communication that combines words, images, and ideas to convey information to an audience. Graphic designers are experts who ...What are the eligibility criteria for the Graphic Design course?In how many levels is the Graphic Design course offered?",https://www.shiksha.com/design/graphic-design-chp
BA (Hons) Graphic Design | Online Graphic Design Courses,"Throughout your course of study, your specialist tutor will support you and your work, enabling you to work independently, ready for the world of visual ...",https://www.oca.ac.uk/courses/ba-graphic-design
How To Become a Graphic Designer? - Complete Step-by- ...,"Sep 28, 2022 —",https://www.simplilearn.com/how-to-become-graphic-designer-article
Graphic Design Course List,"Theoretical topics covered include affordances, embodied cognition, multisensory perception, design thinking, inclusion, authorship, globalism and ...",https://www.mica.edu/undergraduate-majors-minors/course-lists/graphic-design-course-list/
Certificate in Graphic Design,"Cost $4,000 to $6,250. Depending on selected options and required prerequisites, the approximate cost to complete the Certificate in Graphic Design is between ...",https://conted.ucalgary.ca/public/category/courseCategoryCertificateProfile.do?method=load&certificateId=6100405
BA (Hons) Graphic Design,"On this course, you'll learn to innovate under pressure and handle issues such as user- centred design, sustainability, emerging technology, service design, ...",https://aub.ac.uk/course/graphic-design
Graphic Design,Fanshawe's graphic design program provides the necessary courses to teach students the skills to create designs for interactive and print projects.,https://www.fanshawec.ca/programs/grd1-graphic-design/next
Graphic Design Learning Path,Courses in this path · Photoshop CC Selections · Photoshop CC Working with Type · Understanding the Pen Tool in Photoshop · Photoshop CC Smart Objects · Creating ...,https://www.pluralsight.com/paths/graphic-design
Web and Graphic Design Diploma,"Mar 20, 2023 — FEES: START DATE:",https://cnc.bc.ca/programs-courses/programs/detail/web-and-graphic-design-diploma
Art & Design Courses | Harvard University,"Browse the latest online art & design courses from Harvard University, ... as text and as ""little movies"" that immerse the viewer through visual narration.",https://pll.harvard.edu/subject/art-design
Graphic Design (Online),"Please note: Graphic Design is also offered in-class. Centennial College's Graphic Design program, which has a graduate employment rate th.",https://www.centennialcollege.ca/programs-courses/full-time/graphic-design-online/
Graphic Designers courses,"Graphic Design with Foundation Year · Buckinghamshire New University High Wycombe. Buckinghamshire New University, High Wycombe. Qualification: BA (Hons).",https://www.ucas.com/explore/courses?soc=3421&filterBy=all
Google UX Design Professional Certificate,"This is your path to a career in UX design. In this program, you'll learn in-demand skills that will have you job-ready in less than 6 months.",https://www.coursera.org/professional-certificates/google-ux-design
The 11 Best UX Design Courses in 2023,"May 10, 2023 — Are UX design courses worth it?What course is best for UX design?",https://careerfoundry.com/en/blog/ux-design/ux-design-course-online/
UX Design Courses | Learn User Experience ...,"Online, self-paced UX Courses created by design experts. Join over 153340 students in the world's largest design school and gain recognized certificates.",https://www.interaction-design.org/courses
Google UX Design Certificate,Get started in the fast-growing field of user experience (UX) design with a professional certificate developed by Google. Learn the foundations of UX design ...,https://grow.google/certificates/ux-design/
UI/UX Design - CIIT Philippines School - Multimedia Arts ...,"Explore the different phases of user-interface and user-experience processes from research, designing, prototyping and a lot more. By the end of the specialist ...",https://www.ciit.edu.ph/specialist-courses/ui-ux-design/
UX Design,Master Design Thinking and UX Design through user-centred design to deliver innovative user experiences. Learn divergent ideation methods to bring ...,https://www.edx.org/course/ux-design
User Experience Design: Online Courses for Digital Products,,https://www.udemy.com/courses/design/user-experience/
UX Design Online Training Courses,"1,973Results for ""UX Design"" · Adobe XD Essential Training: Design · SwiftUI Essential Training · Learning Adobe XD · UX Foundations: Information Architecture · UX ...",https://www.linkedin.com/learning/topics/ux-design
Digital Skills: User Experience - Online Course,What is a UX designer? ... You'll begin the course examining what user experience means and how it's integral to creating high-quality products. Using this ...,https://www.futurelearn.com/courses/digital-skills-user-experience
UX Design Course,"UX is the future of the design discipline. A powerful complement to backgrounds in visual design, marketing, product, engineering, business strategy, and more, ...",https://generalassemb.ly/education/user-experience-design
UX Design (Full-Time),This course introduces students to the Human-Centered Design (HCD) process through a collaboration between KodeGo and UX Philippines.,https://kodego.ph/courses/18
UX Design Institute: The gold standard in UX education,"Professional Certificate. UI Design. Master key concepts and techniques of UI design. 12 weeks $2,100 · Short course. UX Design Fundamentals. Get a ...",https://www.uxdesigninstitute.com/
UX Design Course Online,"In a UX design course, you can learn the fundamentals of the user experience design process, how to leverage UX research, personas, and design thinking to ...Jun 3 - Jun 24Jun 13 - Aug 8Jul 16 - Aug 13",https://brainstation.io/course/online/user-experience-design
Introduction to UI and UX Design,About this course ... User Interface (UI) and User Experience (UX) Design play key roles in the experience users have when interacting with digital products and ...,https://www.codecademy.com/learn/intro-to-ui-ux
Online UI/UX Design ClassesUX Design Classes Online,"Find what fascinates you as you explore these UI/UX Design classes. ... Advanced Prototyping and Interaction Design in Figma for UI/UX Designers.Skillshare is a learning community for creators. Anyone can take an online class, watch video lessons, create projects, and even teach a class themselves.",https://www.skillshare.com/browse/ui-ux-design
UI/UX Design Courses Singapore,UX Design Course Curriculum · Pre-Work · Module 1: Introduction to User Experience Design · Module 2: User Research & Design Thinking Ideation · Module 3: ...,https://verticalinstitute.com/user-experience/
Online UX Design Course: Getting Started,"This course will help you understand what UX designers do, how they do it, and how you can get started.",https://www.pluralsight.com/courses/getting-started-ux-design
Designlab: UI and UX Design Courses Online,"If you have previous experience as a graphic, web, or digital designer or are a Foundations graduate, then UX Academy might be for you. UX Academy is an ...",https://designlab.com/
User Experience (UX) Design - Faculty of Media & Creative Arts,Humber's User Experience (UX) Design graduate certificate simulates the interdisciplinary approaches needed to achieve an innovation process with a focus on ...,https://mediaarts.humber.ca/programs/ux-design.html
Best UX UI Certification Course in India,"UX UI Design Course from Scratch ensures that you'll learn the latest research methods, ideation, and visual design skill through interactive examples ...Sat, May 27Sat, May 27Sat, May 27",https://designerrs.com/courses/ux-ui-design-course/
User Interface (UI) and User Experience (UX) Design,"With the applied training you receive throughout this BCIT program, you'll build a solid foundation in UI and UX design to add to your existing professional ...Monitor: Operating System:",https://www.bcit.ca/programs/user-interface-ui-and-user-experience-ux-design-associate-certificate-part-time-5985acert/
Interactive UX design courses,Taking a UX design course can help you develop the skills and knowledge needed to create user-centered designs that meet the needs of your target audience.,https://app.uxcel.com/courses
Free UX Design Courses with Certificates | Enroll NowUI UX Design Course with Free Online Certificate,"Great Learning Academy offers a variety of UX Design Courses. User Experience (UX) and User Interface (UI) course discusses designs involved in web and app ...Learn UI UX Design from basics in this free online training. This free UI UX Design course is taught hands-on by experts. Cover basic concepts, Difference ...",https://www.mygreatlearning.com/ux-design/free-courses
UX & UI Design courses - RMIT Online,UX & UI Design courses and degrees · User Experience Design · User Interface Design · UX + UI Design · Graduate Certificate in Digital Product Design · Graduate ...,https://online.rmit.edu.au/design/ux-ui-design
Free UX Design Course For Beginners! (Start Today!) - YouTube,11 key moments,https://www.youtube.com/watch?v=rvBf_dQky7Q
"UI UX Design Course, UI UX Bootcamp Certification",The UI UX design course duration is set at 12 weeks during which you will become a competent UI UX designer. 3. Who is this UI/UX design course for? This UI/UX ...,https://www.upgrad.com/bootcamps/ui-ux-design-course/
The best UX Design courses in 2022 | by Amy H,"There are so many UX design courses available right now, and so many different training providers, it can be overwhelming to work out the best UX design ...",https://uxplanet.org/the-best-ux-design-courses-in-2022-a93a71f658a8
UCT User Experience Design Online Short Course,"On completion of this course, you'll walk away with: A 12-month personal development road map that outlines your growth as a UX design practitioner. The ability ...$909.00",https://www.getsmarter.com/products/uct-user-experience-design-online-short-course
UX Design,"July 2023. After passing this course' assessment, you will get direct access to Udacity classroom ... Knowledge of UX design fundamentals is preferred.",https://egfwd.com/specializtion/ux-design/
Introduction to UX Design Course,Learn UX fundamentals online in our Introduction to UX Design Course. Work with your mentor to build your first project & start your UX career today!,https://www.springboard.com/courses/introduction-to-design/
UI/UX Design Certification Course Online,"UI UX Design course covers the concepts of Design Thinking, UX Research, UI prototyping and styling, Usability and Testing. Enroll Now for UI UX Design ...Mon, May 29Jul 8 - Oct 1",https://www.simplilearn.com/ui-ux-design-masters-program-certification-course
Certificate in UX & Visual Interface Design,"University of Washington offers a certificate program in UX and visual interface design, with flexible evening and weekend classes to fit your schedule.",https://www.pce.uw.edu/certificates/ux-and-visual-interface-design
UX Design Course | UCD Professional Academy,UX Design Course Modules ; 1. Introduction To UX Design · Product integrity and desirability; UX and agile process; UX and UI design; Prototyping ; 2. User ...,https://www.ucd.ie/professionalacademy/findyourcourse/professional-diploma-in-ux-design/
UX Design Course,UX Design Course · Learn from seasoned experts on our 100% online UX design course. · Our online UX design course is the perfect way to start your career in a ...,https://www.creativebloq.com/ux-design-foundations-online-course
Google UX Design Certificate,"Enrol now to learn the foundations of UX design, including empathising with users, building wireframes and prototypes, and conducting research to test your ...",https://learndigital.withgoogle.com/digitalworkshop-eu/course/gccs-ux-design
Compare The 12 Best UI/UX Design Courses Online [2023],"Aug 24, 2022 —",https://dribbble.com/resources/ui-ux-design-course
How to Become a UX Designer: Step-By-Step Guide (2023),"Apr 25, 2022 —",https://blog.hubspot.com/website/become-a-ux-designer
6 Online UX Courses From Beginner to Specialized UX ...,The Benefits of Studying UX Design · Free Report: 7 Quick UX Fixes for Your E-Commerce Site · Best E-Commerce UX Course: Baymard UX Certification · Google's UX ...,https://baymard.com/learn/ux-courses
Learn UX Design | Online UX Course,You'll learn how to create a digital user experience that is ready to be handed off for development. You'll start by building familiarity and fluency with ...,https://www.udacity.com/course/ux-designer-nanodegree--nd578
Avocademy - Introduction to UX Design Course,1-on-1 mentoring sessions with UX/UI designers. ... One of the most affordable UX/UI Design Bootcamps. ... What will I know at the end of the course?,https://www.avocademy.com/
Learn UI/UX Design at DesignCourse,Join the most interactive course for learning UI/UX Design with Gary Simon.,https://designcourse.com/
UX Design Course: Learn User Experience Design at ...,UX Designers create enjoyable experiences for users interacting with digital tools (like websites or apps). They conduct user research and find elegant ...,https://www.careerist.com/ux
Dive into UX Design,"In this course, you'll get an introduction to user experience design, examining the origins of the field to the numerous professional contexts in which you ...",https://openclassrooms.com/en/courses/4555336-dive-into-ux-design
10+ Best UX Design Courses for Beginners [2021],"In this course, learn how to apply User Experience (UX) principles to your website designs, code a variety of sites, and increase sales.",https://medium.com/quick-code/top-online-courses-to-learn-ux-design-efdd9a18689e
Professional Program in User Experience (UX) Design,Required Courses · Essentials of User Experience (UX) Design. DESIGN X429. Units / CEUs: 2 · Diagramming and Prototyping for UX. DESIGN X476. Units / CEUs: 2.,https://extension.berkeley.edu/public/category/courseCategoryCertificateProfile.do?method=load&certificateId=29918624
UI UX Design Courses with Job Guarantee,UX UI DESIGN COURSES · CERTIFICATE. 18 Weeks110+ Hours of Live SessionsPart-time (Evening/Weekend)Placement Support · DIPLOMA. 34 Weeks210+ Hours of Live Sessions ...,https://www.andacademy.com/ux-ui-design-courses/
Congrats on finishing the Google UX certificate! Here is ...,"Since Google launched its User Experience Design certificate on Coursera, ... The Google UXD course is a great start, but there's definitely a lot more to ...",https://uxdesign.cc/congrats-on-finishing-the-google-ux-course-here-is-whats-next-for-you-bbba84498ddd
UI UX Design Course: Learn UI UX Online with Certification,UI UX Design Course is a beginner-friendly course designed by industry experts to help you learn the UI/UX from scratch and become a pro. This is an online ...,https://trainings.internshala.com/ui-ux-design-course/
UI / UX Design Specialization (CalArts),"This course is focused on the early user experience (UX) challenges of research, planning, setting goals, understanding the user, structuring content, and ...",https://www.coursera.org/specializations/ui-ux-design
These Are The 7 Best UI Design Courses In 2023 [Updated],"May 11, 2023 —",https://careerfoundry.com/en/blog/ui-design/best-ui-design-courses/
Learn UI Design: The Complete Online Video Course,"Learn UI Design 2.0 is a full-length online course on user interface and web design: color, typography, layout, design process, and more.",https://learnui.design/
The 9 best UI design courses to consider in 2023,"Learn design fundamentals with a 4-week course at $349 · Prepare for a job as a UI designer with the UI/UX Design Career Track at $14,310 · Expert mentorship ...",https://www.uxdesigninstitute.com/blog/best-ui-design-courses/
Learn UI Design from Dribbble's Experts,Our UI course is an introduction into the world of design and is conducted differently to traditional online education! You're not teaching yourself; we match ...,https://dribbble.com/courses/ui-design
Top User Interface Design Courses Online,Top courses in User Interface Design and User Experience Design · Figma UI UX Design Essentials · Master Digital Product Design: UX Research & UI Design · How To ...,https://www.udemy.com/topic/user-interface/
The 9 Best UI Design Courses for Beginners [2023 Guide],5 days ago —,https://www.springboard.com/blog/design/best-ui-design-courses/
UI Design for Beginners | FREE COURSE - YouTube,11 key moments,https://www.youtube.com/watch?v=N-xuqy6x1Bw
UI Design Course,"Master the art of a product's visual language with our UI Design course. Working together with a professional mentor, you'll learn how to identify modern ...",https://designlab.com/ui-design-course/
UI/UX Design - CIIT Philippines School - Multimedia Arts ...,"By the end of the specialist class, everything that you have learned will be applied in a final UI/UX design project that you can add to your portfolio to ...",https://www.ciit.edu.ph/specialist-courses/ui-ux-design/
Top 10 Best UI Design Courses to Learn in 2023,"Mar 23, 2023 —",https://mockitt.wondershare.com/ui-ux-design/ui-design-course.html
Introduction to UI and UX Design,About this course ... User Interface (UI) and User Experience (UX) Design play key roles in the experience users have when interacting with digital products and ...,https://www.codecademy.com/learn/intro-to-ui-ux
UI Design Course Online,"Through BrainStation's live UI Design course, you'll learn user interface design principles and industry tools to create beautiful interfaces that resonate ...Jun 15 - Aug 3Aug 1 - Sep 19Sep 20 - Nov 8",https://brainstation.io/course/online/user-interface-design
UI Design Classes Online,"What will you discover as you learn more about UI design? With these Skillshare classes, you can take your skills further, exploring new techniques and topics, ...",https://www.skillshare.com/browse/ui-design
Free UI Design Courses with Certificates | Learn for Free,How can I learn UI design for free? Great Learning Academy provides free courses for learning UI and UX. You will also be given a certificate after successfully ...What is a UI design course?Will I get a certificate after completing these free UI Design courses?,https://www.mygreatlearning.com/ui-design/free-courses
UX Design Courses & Global UX Community | IxDF,Discover the entire spectrum of UX design from 30+ courses & local meetups. Learn from industry experts and gain recognized certificates.,https://www.interaction-design.org/
Learn UI/UX Design at DesignCourse,Join the most interactive course for learning UI/UX Design with Gary Simon.,https://designcourse.com/
UX & UI Design courses - RMIT Online,UX & UI Design courses and degrees · User Experience Design · User Interface Design · UX + UI Design · Graduate Certificate in Digital Product Design · Graduate ...,https://online.rmit.edu.au/design/ux-ui-design
UX/UI Design - UAlberta Extension - University of Alberta,"The fully online UX/UI Design Certificate teaches participants the foundations of both UX and UI design, how to approach problems from a user-centred ...",https://ext.ualberta.ca/enroll/uxui
UI Designer,User Interface (UI) Design Courses. UI design professionals are in high demand everywhere in the world. Take this program to set yourself up for a ...,https://tamwood.com/careers/ui-designer/
Explore our UX/UI Design courses,UX/UI Design · Learn how to design user interfaces that are both appealing and easy to use · Gain a deep understanding of how users interact with digital products ...,https://academyxi.com/online-courses/ux-ui-design/
UX Design,Master Design Thinking and UX Design through user-centred design to deliver innovative user experiences. Learn divergent ideation methods to bring ...,https://www.edx.org/course/ux-design
12 Best Free UX/UI Design Courses For Beginners,"Jan 31, 2023 —",https://medium.com/@mdmansurulhaques/12-best-free-ux-ui-design-courses-on-the-internet-5a02f2f6a1c2
Google UX Design Certificate,What are the UX design courses in the curriculum?,https://grow.google/certificates/ux-design/
