title,description,url
CS50: Introduction to Computer Science | Harvard University,"An entry-level course taught by David J. Malan, CS50x teaches students how to think algorithmically and solve problems efficiently. Topics include abstraction, ...",https://pll.harvard.edu/course/cs50-introduction-computer-science
Introduction to Computer Science and Programming ...,"Learners will master the fundamentals of computer science by solving mathematical puzzles using interactive techniques, becoming a detective and solving crimes ...",https://www.coursera.org/specializations/introduction-computer-science-programming
CS50's Introduction to Computer Science,This course is part of CS50's AP® Computer Science Principles XSeries Program ; Expert instruction. 2 high-quality courses ; Self-paced. Progress at your own ...,https://www.edx.org/course/introduction-computer-science-harvardx-cs50x
CS101: Introduction to Computer Science I,This course will introduce you to the field of computer science and the fundamentals of computer programming. CS101 is specifically designed for students ...,https://learn.saylor.org/course/CS101
Introduction to Computer Science and Programming,Course Description. 6.00SC Introduction to Computer Science and Programming has been retired from the OCW site. It was taught using a version of Python that ...,https://ocw.mit.edu/courses/6-00sc-introduction-to-computer-science-and-programming-spring-2011/
Introduction to Computer Science (CS 101) for Beginners,10 key moments,https://www.youtube.com/watch?v=CNFK86hJRfE
Introduction to Programming and Computer Science - YouTube,21 key moments,https://www.youtube.com/watch?v=zOjov-2OZ0E
10 Best Computer Science Courses to Take in 2022,"Mar 8, 2022 — Level: Institution: Certificate: Provider:",https://www.freecodecamp.org/news/best-computer-science-courses/
Introduction to Computer Science,Course content · Computer Science Introduction3 lectures • 19min · Computer Science Programming4 lectures • 23min · Computer Science Algorithms2 lectures • 10min.,https://www.udemy.com/course/introduction-to-computer-science/
Introduction to computer science and programming ...,This specialisation covers topics ranging from basic computing principles to the mathematical foundations required for computer science.,https://www.london.ac.uk/courses/introduction-computer-science-and-programming-specialisation
Introduction to Computer Science,"We use pseudocode and the Java programming language for all assignments and exams in the course, but many Java features, such as applets, GUI programming, Java ...",https://introcs.cs.rutgers.edu/
Introduction to Computer Science and Engineering,You'll learn how to use a MaKey MaKey board and Scratch programming to invent games and solve problems. Get ready to take a hands-on approach in this fun course ...,https://cty.jhu.edu/programs/online/courses/introduction-to-computer-science-and-engineering-cse
Introduction to Computer Science,"Nov 22, 2022 —",https://en.wikiversity.org/wiki/Introduction_to_Computer_Science
Computer science,"Our mission is to provide a free, world-class education to anyone, anywhere. Khan Academy is a 501(c)(3) nonprofit organization. Donate or volunteer today!",https://www.khanacademy.org/computing/computer-science
CS 101 - Intro to Computers,Course Overview · Computer Hardware (~3 lectures) · Introduction to Code (~5 lectures) · Artificial Intelligence (~1 lecture) · The Internet and the Web(~4 lectures) ...,https://web.stanford.edu/class/cs101/lecture01.html
Path to a free self-taught education in Computer Science!,"This course will introduce you to the world of computer science. Students who have been introduced to programming, either from the courses above or through ...",https://github.com/ossu/computer-science
introduction.pdf,"Apr 28, 2023 —",https://cs.fit.edu/~ryan/cse1002/lectures/introduction.pdf
Introduction to Computer Programming from Coursera,"If you are interested in learning how to write interactive, graphical programs from an introductory level in a real programming language, this is the course ...",https://www.classcentral.com/course/introduction-to-computer-programming-12185
Introduction To Computer Science,"It involves studying computer architecture, hardware engineering, data structures, algorithms, programming languages, and operating systems. Computer scientists ...",https://www.learncomputerscienceonline.com/introduction-to-computer-science/
Introduction to Computer Programming | Online,"Students develop introductory knowledge of computer programming with emphasis on problem analysis and design, using algorithms, pseudocode, flowcharts, UML ...",https://www.algonquincollege.com/online/courses/introduction-to-computer-programming-2/
Introduction to Computer Science ICS3U Online Course,"The aim of this course is to introduce students to computer programming. In order to achieve this goal, a wide variety of instructional strategies are used to ...",https://www.virtualhighschool.com/courses/outlines/ics3u.asp
Computer Science and Engineering (CSE),"Introductory course for students interested in computer science and ... basic programming constructs introduced in CSE 8A to introduce class design and use, ...",https://catalog.ucsd.edu/courses/CSE.html
CMSC 10 – Introduction to Computer Science,"This is a core/major course to introduce students to software systems and methodologies in software development, computer theory, and computer organization ...",https://dmpcs.upmin.edu.ph/cmsc-10-introduction-to-computer-science/
"ICS3U Introduction to Computer Science, Grade 11 ...","ICS3U Introduction to Computer Science, Grade 11, University Preparation. An image of a programmer working on a computer.",https://lah.elearningontario.ca/CMS/public/exported_courses/ICS3U/exported/interface/_content.html
Introduction to Computer Science (CMPT 141),An introduction to computer science and problem solving using procedural programming. This course introduces the basic computer science and computer ...,https://catalogue.usask.ca/CMPT-141
Computer Science - College Catalog - The University of Chicago,"There is one approved general program for both the BA and BS degrees, comprised of introductory courses, a sequence in Theory, and a sequence in Programming ...",http://collegecatalog.uchicago.edu/thecollege/computerscience/
8 Best Computer Science Courses for Beginners to Learn ...,There are 3 online courses in this specialization as shown below: Introduction to Computer Programming; How Computer Works; Mathematics for Computer Science.,https://medium.com/javarevisited/8-best-computer-science-courses-for-beginners-to-learn-online-696379aa4e96
Introduction to Computer Programming,"In this course, students learn the fundamentals of computer programming that serve as a foundation for developing software applications and further ...",https://college.berklee.edu/courses/lmsc-261
Introduction to Computer Science and Programming I,"This course is an introduction to computing science and program design, suitable for students with little or no programming background.",https://www.columbiacollege.ca/programs/course/csci-120/
Introduction to Computer Science I Course,"Introduction to computer science via theory, applications, and programming. Basic data types, operators and control structures. Input/output. Procedural and ...",https://www.uclaextension.edu/digital-technology/programming/course/introduction-computer-science-i-com-sci-xl-31
Computer science,Algorithms and data structures are central to computer science. The theory of computation concerns abstract models of computation and general classes of ...,https://en.wikipedia.org/wiki/Computer_science
Introduction to Computer Science (Collie) - Overview,The CodeHS introduction to computer science curriculum teaches the ... This course is a semester-long version of our Intro to JavaScript (Golden) course.,https://codehs.com/course/introjs_collie/overview
ECS 015: Introduction to Computers,"ECS 015: Introduction to Computers ... Computer uses in modern society. Emphasis on uses in non-scientific disciplines. Includes word processing, spreadsheets, ...",https://cs.ucdavis.edu/schedules-classes/ecs-015-introduction-computers
Computer Science,"This course is a broad introduction to computing technology for humanities and social science students. Topics will be drawn from current issues and events, ...",https://www.princeton.edu/academics/area-of-study/computer-science
COMP_SCI 110: Intro to Computer Programming,"Introduction to programming practice using Python. Analysis and formulation of problems for computer solution. Systematic design, construction, and testing of ...",https://www.mccormick.northwestern.edu/computer-science/academics/courses/descriptions/110.html
A breadth-first introduction to CS – Computer Science,"A typical breadth-first introductory course, sometimes called a “CS0” course, surveys not only the basics of computer programming (including algorithms and data ...",https://wp.stolaf.edu/cs/a-breadth-first-introduction-to-cs/
Introduction to Computer Science,"This course is an introduction to computer programming, intended for the student who is interested in learning to write and interpret JAVA computer programs ...Course Credits:",https://fueledbylaunch.com/courses/introduction-to-computer-science/
Building skills for life: How to expand and improve ...,"Oct 25, 2021 —",https://www.brookings.edu/essay/building-skills-for-life-how-to-expand-and-improve-computer-science-education-around-the-world/
Computer Science Course Descriptions,CS 100 — Introduction to Computing (3) This course is an introduction to the broad and dynamic field of computing for nonmajors.,https://www.kings.edu/academics/undergraduate_majors/computerscience/course_descriptions
CS 111 - Introduction to Computer Science - Acalog ACMS™,"The purpose of this course is to introduce the fundamental concepts of computer programming, software and hardware, with an emphasis on preparing students ...",https://catalog.ecc.edu/preview_course_nopop.php?catoid=11&coid=16527
Introduction to Computer Science 1 - 5002010,"1.2 Conduct basic keyword searches, and exchange information and feedback with teachers and other students (e.g., ... 2. Courses.",https://www.cpalms.org/PreviewCourse/Preview/14587
Introduction to Computer Science with MakeCode for Minecraft,"This is a semester-long course targeted at middle school grades 6-8, as an introduction to Computer Science. The course is written for teachers who may have ...",https://minecraft.makecode.com/courses/csintro
Which is the best Introduction to Computer Science course ...,You cannot go wrong with 'Introduction to Computer Science and Programming using Python' from MIT given on edX platform. · The nice thing of that course is that ...,https://www.quora.com/Which-is-the-best-Introduction-to-Computer-Science-course-available-online
Introduction to Computing Science I,"Introduction to design, analysis, and implementation of algorithms. Recursion, backtracking, and exits. Sequences. Elementary searching and sorting.Course Dates: Exam Dates (if applicable): Program Year: Code/Units:",https://www.queensu.ca/artsci_online/courses/introduction-to-computing-science-i
Intro to computer science curriculum - TEALS Program,Introduction to Computer Science is an engaging course that explores a variety of basic computational thinking and programming concepts through a project-based ...,https://tealsk12.github.io/introduction-to-computer-science/
Intro to CS - MakeCode - Micro:bit,"This course is targeted to middle school grades 6-8 (ages 11-14 years). It is also written for teachers who may not have a Computer Science background, ...",https://makecode.microbit.org/courses/csintro
CS Curriculum for grades 9-12,"For high schools, we offer two years computer science courses for ... CS Discoveries is an introductory course for 6-10th grade students that can be ...",https://code.org/educate/curriculum/high-school
COMP 0011 Introduction to Computer Science,"Course Description. The study of computer science centers on two complementary aspects of the discipline. First, computer science is fundamentally concerned ...",https://enroll.tufts.edu/search/publicCourseSearchDetails.do?method=load&courseId=24162
Introduction to Computers and Computer Programming,"The Course Catalog contains a description of specific polices, programs, degree requirements, and course offerings for Undergraduate and Graduate students ...",https://catalog.usf.edu/preview_course_nopop.php?catoid=4&coid=8599
Data Structures and Algorithms Professional Certificate | edX,"The Data Structures and Algorithms Professional Certificate from GTx is a four-course series covering the foundations of data structures, and designing efficient algorithms. The learner will examine and implement the principles of data storage in low-level data structures such as LinkedLists, Stacks and Queues.","https://www.edx.org/professional-certificate/gtx-data-structures-and-algorithms#:~:text=The%20Data%20Structures%20and%20Algorithms,as%20LinkedLists%2C%20Stacks%20and%20Queues."
Data Structures and Algorithms Professional Certificate | edX,,"https://www.edx.org/professional-certificate/gtx-data-structures-and-algorithms#:~:text=The%20Data%20Structures%20and%20Algorithms,as%20LinkedLists%2C%20Stacks%20and%20Queues."
Data Structures and Algorithms Specialization (UCSD),"In this online course, we consider the common data structures that are used in various computational problems. You will learn how these data structures are ...",https://www.coursera.org/specializations/data-structures-algorithms
Best Data Structures Courses Online | Beginner → Advanced,Top courses in Data Structures and Algorithms · Master the Coding Interview: Data Structures + Algorithms · JavaScript Algorithms and Data Structures Masterclass.,https://www.udemy.com/topic/data-structures/
10 Best Data Structures and Algorithms Courses [2023]Data Structures and Algorithms Online Courses : Free and ...,"Jan 26, 2023 — The DSA online course is designed to improve your problem-solving and coding skills by enhancing your understanding of Data Structures & Algorithms. The primary ...",https://www.geeksforgeeks.org/best-data-structures-and-algorithms-courses/
Intro to Data Structures and Algorithms | Free Courses,This course will introduce you to common data structures and algorithms in Python. You'll review frequently-asked technical interview questions and learn ...,https://www.udacity.com/course/data-structures-and-algorithms-in-python--ud513
7 Best Courses to learn Data Structure and Algorithms,7 Best Data Structures and Algorithms Courses for Programmers · 1. Data Structures and Algorithms: Deep Dive Using Java · 2. JavaScript Algorithms and Data ...,https://medium.com/javarevisited/7-best-courses-to-learn-data-structure-and-algorithms-d5379ae2588
Learn Data Structures and Algorithms,"Our DSA tutorial will guide you to learn different types of data structures and algorithms and their implementations in Python, C, C++, and Java.",https://www.programiz.com/dsa
10 Best Data Structures & Algorithms Courses to Take in ...,"Apr 18, 2022 — Level: Rating:",https://www.classcentral.com/report/best-algos-data-structure-courses/
Data Structures and Algorithms - Harvard Online Courses,"This is a rigorous course on the design and analysis of efficient algorithms and their associated data structures. Algorithm design methods, graph algorithms, ...",https://pll.harvard.edu/course/data-structures-and-algorithms
Algorithms and Data Structures Tutorial - Full Course for ...,3 key moments,https://www.youtube.com/watch?v=8hly31xKli0
Data Structures and Algorithms in Python - YouTube,10 key moments,https://www.youtube.com/watch?v=pkYVOmU3MgA
Data structures and Algorithms Course - Learn & Master ...,Total fee: Rs 3.59L inclusive of GST at super affordable EMI options. Try the course for the first 2 weeks - full money-back guarantee if you choose to withdraw ...,https://www.scaler.com/courses/data-structures-and-algorithms/
JavaScript Algorithms and Data Structures Certification,"In this course, you'll learn fundamental programming concepts in JavaScript. You'll start with basic data structures like numbers and strings.",https://www.freecodecamp.org/learn/javascript-algorithms-and-data-structures
Data Structures & Algorithms,"Learning goals. Familiarize yourself with common data structures and algorithms such as lists, trees, maps, graphs, Big-O analysis, and more! Suggested ...",https://techdevguide.withgoogle.com/paths/data-structures-and-algorithms/
Data Structures and Algorithms in Python | Jovian,"A beginner-friendly introduction to common data structures (linked lists, stacks, queues, graphs) and algorithms (search, sorting, recursion, dynamic ...",https://jovian.com/learn/data-structures-and-algorithms-in-python
Introduction to Algorithms - MIT OpenCourseWare,"This course is an introduction to mathematical modeling of computational problems, as well as common algorithms, algorithmic paradigms, and data structures ...",https://ocw.mit.edu/courses/6-006-introduction-to-algorithms-spring-2020/
15 Best Courses for Data Structures and Algorithms (2023),"May 11, 2023 —",https://www.interviewbit.com/blog/best-courses-for-data-structures-and-algorithms/
Data Structures and Algorithms - ASU CareerCatalyst,"Algorithms are generally created independent of underlying languages, i.e. an algorithm can be implemented in more than one programming language. Data structure ...$59.00",https://careercatalyst.asu.edu/programs/data-structures-and-algorithms/
Learn Algorithms with TypeScript for Interviews,"Sep 12, 2022 —",https://frontendmasters.com/courses/algorithms/
COMP 2231: Data Structures and Algorithms,Course topics · Module 1: Analysis of Algorithms & Searching and Sorting · Module 2: Stacks & Queues · Module 3: Lists & Iterators · Module 4: Trees & Binary Search ...,https://www.tru.ca/distance/courses/comp2231.html
Data Structures and Algorithms – COMPSCI X404.1,"We will focus on arrays, linked lists, stacks, queues, hash tables, trees, heaps, graphs, and their associated algorithms (e.g., searching, sorting, traversal, ...",https://extension.berkeley.edu/search/publicCourseSearchDetails.do?method=load&courseId=31082496
Introduction to Data Structures and Algorithms,Course Details. Data Structures And Algorithms. Introduction to Data Structures and Algorithms; Stacks; Queues and Linked Lists; Dictionaries; Hashing ...,https://nptel.ac.in/courses/106102064
The Ultimate Data Structures & Algorithms Course,"This course is divided into three parts, each about 5 hours long so you can easily complete it. The first part is all about linear data structures and their ...",https://codewithmosh.com/p/data-structures-algorithms
Data Structures and Algorithms,"Course also examines algorithms for sorting, searching and some graph algorithms. Algorithm analysis and efficient code design is discussed. Learning Outcomes.",https://www.nu.edu/degrees/computerscienceandinformationsystems/courses/csc335/
Algorithms and Data Structures - Tracks,"This course will look at algorithms in two categories: sorting and searching. You'll implement well-known sorting algorithms like selection sort, quicksort, and ...",https://teamtreehouse.com/tracks/algorithms-and-data-structures
LeetCode's Interview Crash Course,"The point of this course is to help you truly understand the most common data structures, algorithms, patterns, how to recognize when to use them, and how to ...$89.99",https://leetcode.com/explore/interview/card/leetcodes-interview-crash-course-data-structures-and-algorithms/
Algorithms and Data Structures - Part 1,,https://www.pluralsight.com/courses/ads-part1
Course Unit BSCS1003 Data Structures and Algorithms ...,Data Structures and Algorithms (10 cr). Responsible organisation: Bachelor´s Programme in Science. Responsible teacher for course unit: Juha Kärkkäinen.,https://studies.helsinki.fi/courses/cu/hy-CU-128550261-2021-08-01/BSCS1003/Data_Structures_and_Algorithms
Learn Data Structures and Algorithms with Python,Skill level. Intermediate · Time to complete. Approx. 40 hours · Certificate of completion. Included with paid plans · Prerequisites. 1 course. We suggest you ...,https://www.codecademy.com/learn/learn-data-structures-and-algorithms-with-python
7 data structure and algorithm courses: a guide,"Mar 14, 2023 —",https://uk.indeed.com/career-advice/career-development/data-structure-and-algorithm-course
DSA Interview Course,A self-paced DSA course by EnjoyAlgorithms to master essential data structures and algorithms concepts and problem-solving techniques to crack the coding ...,https://www.enjoyalgorithms.com/data-structures-and-algorithms-course/
Data Structures and Algorithms in C/C++,"Our course on fundamental algorithms and data structures can help you out. You'll learn how to write scalable code that performs well with large data sets, ...",https://extendedstudies.ucsd.edu/courses-and-programs/data-structures-and-algorithms
ICS 340: Algorithms and Data Structures,Exploration of the design and implementation of data structures and algorithms fundamental to computer systems and applications and to software engineering.,https://www.metrostate.edu/academics/courses/ics-340
Algorithms and Data Structures,,https://u-aizu.ac.jp/course/alg1/
"Data Structures & Algorithms I: ArrayLists, LinkedLists ...","Data Structures & Algorithms I: ArrayLists, LinkedLists, Stacks, and Queues ... The Data Structures & Algorithms course begins with a review of some important ...",https://pe.gatech.edu/courses/data-structures-algorithms-i-arraylists-linkedlists-stacks-and-queues
Free Data Structures Course With Certificate For Beginners,"You will learn about arrays, stacks, queues, and linked lists throughout the course. In addition, complex data structures including heaps, hashing, binary ...",https://www.mygreatlearning.com/academy/learn-for-free/courses/data-structures-in-c
Top 6 Courses to learn Data Structure and Algorithms in ...,6 Best Data Structures and Algorithms Online Training Courses for Programmers in 2023 · 1. Data Structures and Algorithms: Deep Dive Using Java · 2. Master the ...,https://javarevisited.blogspot.com/2018/11/top-5-data-structures-and-algorithm-online-courses.html
Algorithms & Data Structures,Algorithms and data structures are the essential frameworks for solving almost any computer engineering problem. You need a fundamental grasp of these tools to ...,https://www.pce.uw.edu/courses/algorithms-data-structures
"Algorithms: Design and Analysis, Part 1 - Stanford Online","Finally, we'll study how allowing the computer to ""flip coins"" can lead to elegant and practical algorithms and data structures.",https://online.stanford.edu/courses/soe-ycsalgorithms1-algorithms-design-and-analysis-part-1
Free Data Structures and Algorithms Course in C [Hindi],Free Data Structures and Algorithms course gives you a headstart in learning DSA and enables you to bag top jobs in the IT industry. Why should you enroll in ...,https://data-flair.training/courses/data-structures-and-algorithms/
Computer Science 201: Data Structures & Algorithms Course,"May 12, 2023 —",https://study.com/academy/course/computer-science-201-data-structures.html
Data Structures and Algorithms I | SkillsFuture CET Course,"The course gives a comprehensive introduction to algorithm analysis, basic data types such as stacks, queues and trees and how these data types are implemented ...",https://www.suss.edu.sg/courses/detail/mth251
CIS 263 - Data Structures and Algorithms - Courses,"Advanced data structures, including lists, trees, sets, and graphs. Analysis of algorithms. Emphasis on abstract data types, their representations, and role ...",https://www.gvsu.edu/catalog/course/cis-263.htm
COMP SCI 2004NA - Data Structures and Algorithms,Ability to program data structures and use them in implementations of abstract data types. Ability to devise novel solutions to small scale programming ...Course Description: Coordinating Unit:,https://www.adelaide.edu.au/course-outlines/005132/4/tri-1/2014/
Data Structures and Algorithms: Table of Contents,Data Structures and Algorithms - Table of Contents · 2.1 Objects and ADTs · 2.1.1 An Example: Collections · 2.2 Constructors and destructors · 2.3 Data Structure ...,https://www.cs.auckland.ac.nz/software/AlgAnim/ds_ToC.html
CSC 316 Data Structures and Algorithms - Engineering Online,The course will cover the following topics: Abstract data types; abstract and implementation-level views of data types. Linear and branching data structures ...,https://www.engineeringonline.ncsu.edu/course/csc-316-data-structures-and-algorithms/
COMP2123: Data Structures and Algorithms,"The data structures covered in this unit include lists, stacks, queues, priority queues, search trees, hash tables, and graphs. Students will also learn ...Academic unit: Credit points:",https://www.sydney.edu.au/units/COMP2123
Algorithms and Data Structures: 2022-2023,,https://www.cs.ox.ac.uk/teaching/courses/2022-2023/algorithms/
Learn Object-Oriented Programming with Online Courses,"Mar 28, 2023 —",https://www.edx.org/learn/object-oriented-programming
Best Object Oriented Programming Courses & ...,Coursera offers 112 Object Oriented Programming courses from top universities and companies to help you start or advance your career skills in Object ...,https://www.coursera.org/courses?query=object%20oriented%20programming
Object Oriented Programming Courses,Top courses in Object Oriented Programming and Python ; Advanced Python Programming: Build 10 OOP Applications · Rating: 4.5 out of · reviews23.5 total hours ...,https://www.udemy.com/topic/object-oriented-programming/
